[
  {
    "caller": "admin-dashboard",
    "completion_tokens": 0,
    "cost_basis": "modelled",
    "cost_usd": 0.0004,
    "endpoint": "/v1/customers/cus_8e6e214f3f12",
    "error_code": null,
    "flagged_by": [],
    "id": "6da8edd5-7b49-5f61-8b1e-bc8e2672c7e5",
    "is_demo": true,
    "latency_ms": 707.5,
    "method": "GET",
    "model": null,
    "occurred_at": "2026-01-16T07:06:35Z",
    "origin": "upstream",
    "pricing_version": "2026-01-15",
    "prompt_tokens": 0,
    "provider": "stripe",
    "req_hash": "0ab6d77cd6747855",
    "req_size": 90,
    "resp_size": 2101,
    "status": 200,
    "stream": false,
    "tokens_estimated": false,
    "ttfb_ms": 212.2
  },
  {
    "caller": "report-writer",
    "completion_tokens": 71,
    "cost_basis": "billed",
    "cost_usd": 0.00021525,
    "endpoint": "/v1/chat/completions",
    "error_code": null,
    "flagged_by": [],
    "id": "622c14ce-c5ba-5fae-bf3b-225d7042c2b1",
    "is_demo": true,
    "latency_ms": 233.5,
    "method": "POST",
    "model": "gpt-4o-mini",
    "occurred_at": "2026-01-16T07:40:17Z",
    "origin": "upstream",
    "pricing_version": "2026-01-15",
    "prompt_tokens": 1151,
    "provider": "openai",
    "req_hash": "125f024d7f3051a9",
    "req_size": 4824,
    "resp_size": 664,
    "status": 200,
    "stream": false,
    "tokens_estimated": false,
    "ttfb_ms": 70.0
  },
  {
    "caller": "report-writer",
    "completion_tokens": 409,
    "cost_basis": "billed",
    "cost_usd": 0.00041865,
    "endpoint": "/v1/chat/completions",
    "error_code": null,
    "flagged_by": [],
    "id": "f74d30ce-c3e8-5d7a-bcff-a6e17507bf00",
    "is_demo": true,
    "latency_ms": 111.9,
    "method": "POST",
    "model": "gpt-4o-mini",
    "occurred_at": "2026-01-16T08:24:41Z",
    "origin": "upstream",
    "pricing_version": "2026-01-15",
    "prompt_tokens": 1155,
    "provider": "openai",
    "req_hash": "2acda1b235a73315",
    "req_size": 4840,
    "resp_size": 2016,
    "status": 200,
    "stream": false,
    "tokens_estimated": false,
    "ttfb_ms": 33.6
  },
  {
    "caller": "support-bot",
    "completion_tokens": 36,
    "cost_basis": "billed",
    "cost_usd": 0.0001485,
    "endpoint": "/v1/chat/completions",
    "error_code": null,
    "flagged_by": [],
    "id": "3657c955-4880-5f66-afe0-8eaaa3284d73",
    "is_demo": true,
    "latency_ms": 79.7,
    "method": "POST",
    "model": "gpt-4o-mini",
    "occurred_at": "2026-01-16T08:27:53Z",
    "origin": "upstream",
    "pricing_version": "2026-01-15",
    "prompt_tokens": 846,
    "provider": "openai",
    "req_hash": "45470d995d7ee6c2",
    "req_size": 3604,
    "resp_size": 524,
    "status": 200,
    "stream": false,
    "tokens_estimated": false,
    "ttfb_ms": 23.9
  },
  {
    "caller": "support-bot",
    "completion_tokens": 319,
    "cost_basis": "billed",
    "cost_usd": 0.0003093,
    "endpoint": "/v1/chat/completions",
    "error_code": null,
    "flagged_by": [],
    "id": "bc6a2cbd-1cfa-5b83-8e2f-f61c036cba12",
    "is_demo": true,
    "latency_ms": 153.4,
    "method": "POST",
    "model": "gpt-4o-mini",
    "occurred_at": "2026-01-16T09:08:26Z",
    "origin": "upstream",
    "pricing_version": "2026-01-15",
    "prompt_tokens": 786,
    "provider": "openai",
    "req_hash": "1c4353a28ee106cd",
    "req_size": 3364,
    "resp_size": 1656,
    "status": 200,
    "stream": false,
    "tokens_estimated": false,
    "ttfb_ms": 46.0
  },
  {
    "caller": "search-api",
    "completion_tokens": 0,
    "cost_basis": "billed",
    "cost_usd": 1.74e-06,
    "endpoint": "/v1/embeddings",
    "error_code": null,
    "flagged_by": [],
    "id": "c90c311a-ed0f-59e4-b2b2-6a6da9c331e0",
    "is_demo": true,
    "latency_ms": 223.5,
    "method": "POST",
    "model": "text-embedding-3-small",
    "occurred_at": "2026-01-16T10:10:47Z",
    "origin": "upstream",
    "pricing_version": "2026-01-15",
    "prompt_tokens": 87,
    "provider": "openai",
    "req_hash": "e70cfd06adfaa94c",
    "req_size": 568,
    "resp_size": 33000,
    "status": 200,
    "stream": false,
    "tokens_estimated": false,
    "ttfb_ms": 67.0
  },
  {
    "caller": "support-bot",
    "completion_tokens": 66,
    "cost_basis": "billed",
    "cost_usd": 0.00011745,
    "endpoint": "/v1/chat/completions",
    "error_code": null,
    "flagged_by": [],
    "id": "71d08644-159b-5083-9a93-81ff1fb9d488",
    "is_demo": true,
    "latency_ms": 436.3,
    "method": "POST",
    "model": "gpt-4o-mini",
    "occurred_at": "2026-01-16T10:30:05Z",
    "origin": "upstream",
    "pricing_version": "2026-01-15",
    "prompt_tokens": 519,
    "provider": "openai",
    "req_hash": "7d468cd9175ab4b9",
    "req_size": 2296,
    "resp_size": 644,
    "status": 200,
    "stream": false,
    "tokens_estimated": false,
    "ttfb_ms": 130.9
  },
  {
    "caller": "support-bot",
    "completion_tokens": 417,
    "cost_basis": "billed",
    "cost_usd": 0.007615,
    "endpoint": "/v1/chat/completions",
    "error_code": null,
    "flagged_by": [],
    "id": "6de60949-b02c-57b9-8de0-dbf95e9b7c2e",
    "is_demo": true,
    "latency_ms": 101.8,
    "method": "POST",
    "model": "gpt-4o",
    "occurred_at": "2026-01-16T10:53:48Z",
    "origin": "upstream",
    "pricing_version": "2026-01-15",
    "prompt_tokens": 1378,
    "provider": "openai",
    "req_hash": "e28ddc7896d44484",
    "req_size": 5732,
    "resp_size": 2048,
    "status": 200,
    "stream": false,
    "tokens_estimated": false,
    "ttfb_ms": 30.5
  },
  {
    "caller": "admin-dashboard",
    "completion_tokens": 0,
    "cost_basis": "modelled",
    "cost_usd": 0.0004,
    "endpoint": "/v1/customers/cus_bfdd9ee3ac2a",
    "error_code": null,
    "flagged_by": [],
    "id": "17177063-5f27-5e1b-b7bb-e90ab81b11b6",
    "is_demo": true,
    "latency_ms": 355.2,
    "method": "GET",
    "model": null,
    "occurred_at": "2026-01-16T11:38:13Z",
    "origin": "upstream",
    "pricing_version": "2026-01-15",
    "prompt_tokens": 0,
    "provider": "stripe",
    "req_hash": "da589d4de7085e31",
    "req_size": 139,
    "resp_size": 1384,
    "status": 200,
    "stream": false,
    "tokens_estimated": false,
    "ttfb_ms": 106.6
  },
  {
    "caller": null,
    "completion_tokens": 100,
    "cost_basis": "billed",
    "cost_usd": 0.000195,
    "endpoint": "/v1/chat/completions",
    "error_code": null,
    "flagged_by": [],
    "id": "16bc3446-cf4a-51c2-b903-88d0e509ce65",
    "is_demo": true,
    "latency_ms": 482.8,
    "method": "POST",
    "model": "gpt-4o-mini",
    "occurred_at": "2026-01-16T14:07:00Z",
    "origin": "upstream",
    "pricing_version": "2026-01-15",
    "prompt_tokens": 900,
    "provider": "openai",
    "req_hash": "58af124c38f52a71",
    "req_size": 3820,
    "resp_size": 780,
    "status": 200,
    "stream": false,
    "tokens_estimated": false,
    "ttfb_ms": 144.8
  },
  {
    "caller": null,
    "completion_tokens": 90,
    "cost_basis": "billed",
    "cost_usd": 0.000132,
    "endpoint": "/v1/chat/completions",
    "error_code": null,
    "flagged_by": [],
    "id": "194de4f8-f618-571c-ab79-248047427b52",
    "is_demo": true,
    "latency_ms": 178.6,
    "method": "POST",
    "model": "gpt-4o-mini",
    "occurred_at": "2026-01-16T14:07:00Z",
    "origin": "upstream",
    "pricing_version": "2026-01-15",
    "prompt_tokens": 520,
    "provider": "openai",
    "req_hash": "264e520df7414ab7",
    "req_size": 2300,
    "resp_size": 740,
    "status": 200,
    "stream": false,
    "tokens_estimated": false,
    "ttfb_ms": 53.6
  },
  {
    "caller": "completion-worker",
    "completion_tokens": 0,
    "cost_basis": "modelled",
    "cost_usd": 0.0,
    "endpoint": "/v1/chat/completions",
    "error_code": "rate_limit_exceeded",
    "flagged_by": [],
    "id": "23e435e0-89c5-5a43-b453-4a3e2324a5cf",
    "is_demo": true,
    "latency_ms": 52.8,
    "method": "POST",
    "model": "gpt-4o-mini",
    "occurred_at": "2026-01-16T14:07:00Z",
    "origin": "upstream",
    "pricing_version": "2026-01-15",
    "prompt_tokens": 0,
    "provider": "openai",
    "req_hash": "a24b2896028242f8",
    "req_size": 2620,
    "resp_size": 860,
    "status": 429,
    "stream": false,
    "tokens_estimated": false,
    "ttfb_ms": 15.8
  },
  {
    "caller": null,
    "completion_tokens": 120,
    "cost_basis": "billed",
    "cost_usd": 0.000372,
    "endpoint": "/v1/chat/completions",
    "error_code": null,
    "flagged_by": [],
    "id": "4313c14b-ff9b-534b-a5db-1672a160ba08",
    "is_demo": true,
    "latency_ms": 62.0,
    "method": "POST",
    "model": "gpt-4o-mini",
    "occurred_at": "2026-01-16T14:07:00Z",
    "origin": "upstream",
    "pricing_version": "2026-01-15",
    "prompt_tokens": 2000,
    "provider": "openai",
    "req_hash": "781366808527c84e",
    "req_size": 8220,
    "resp_size": 860,
    "status": 200,
    "stream": false,
    "tokens_estimated": false,
    "ttfb_ms": 18.6
  },
  {
    "caller": null,
    "completion_tokens": 90,
    "cost_basis": "billed",
    "cost_usd": 0.000132,
    "endpoint": "/v1/chat/completions",
    "error_code": null,
    "flagged_by": [],
    "id": "46dd84c7-ceb7-52e4-b13a-f10d29697989",
    "is_demo": true,
    "latency_ms": 192.8,
    "method": "POST",
    "model": "gpt-4o-mini",
    "occurred_at": "2026-01-16T14:07:00Z",
    "origin": "upstream",
    "pricing_version": "2026-01-15",
    "prompt_tokens": 520,
    "provider": "openai",
    "req_hash": "99cbbfd5b16f7be3",
    "req_size": 2300,
    "resp_size": 740,
    "status": 200,
    "stream": false,
    "tokens_estimated": false,
    "ttfb_ms": 57.8
  },
  {
    "caller": "long-prompt-worker",
    "completion_tokens": 100,
    "cost_basis": "billed",
    "cost_usd": 0.00325,
    "endpoint": "/v1/chat/completions",
    "error_code": null,
    "flagged_by": [],
    "id": "4d1a4a40-1de2-5d6c-a592-2c317f2edc58",
    "is_demo": true,
    "latency_ms": 228.0,
    "method": "POST",
    "model": "gpt-4o",
    "occurred_at": "2026-01-16T14:07:00Z",
    "origin": "upstream",